matchup,team_a_name,team_b_name,n_simulations,team_a_wins,team_b_wins,ties,team_a_win_pct,team_b_win_pct,team_a_avg_cats_won,team_b_avg_cats_won,team_a_players,team_b_players,team_a_total_games,team_b_total_games
Hardwood Hustlers vs TEAM TOO ICEY BOY 12,Hardwood Hustlers,TEAM TOO ICEY BOY 12,500,15,478,7,0.03,0.956,2.616,8.096,12,13,31,31
BDE vs Burrito Barnes,BDE,Burrito Barnes,500,122,348,30,0.244,0.696,4.23,6.424,16,15,33,37
IN MAMBA WE TRUST vs Cold Beans,IN MAMBA WE TRUST,Cold Beans,500,84,396,20,0.168,0.792,3.97,6.802,13,14,31,33
Jay Stat vs Nadim the Dream,Jay Stat,Nadim the Dream,500,241,233,26,0.482,0.466,5.438,5.254,12,12,30,29
Enter the Dragon vs Team perez,Enter the Dragon,Team perez,500,44,442,14,0.088,0.884,3.568,7.218,13,15,28,37
LF da broccoli vs Team Menyo,LF da broccoli,Team Menyo,500,460,30,10,0.92,0.06,7.32,3.452,12,13,33,27
Team Boricua Squad vs KL2 LLC,Team Boricua Squad,KL2 LLC,500,149,321,30,0.298,0.642,4.552,6.12,9,13,23,28
